<?xml version="1.0" encoding="UTF-8"?>
<inmobiliaria  xmlns:xsi="http://www.w3.org/2001/XMLSchema-instance" 
xsi:noNamespaceSchemaLocation="PostigoJavier_ej5.xsd">

<agencias>
    <agencia>
        <correo_electronico>a21poarja@iesgrancapitan.org</correo_electronico>
        <nombre>Agencia Javier</nombre>
        <telefono>624 50 41 49</telefono>
    </agencia>


</agencias>

<propietarios>

    <propietario>
        <nombre>Javier</nombre>

    </propietario>    
</propietarios>

<propiedades>
    <propiedad>
        <nombre>Casa Javier</nombre>
        <num_pisos>2</num_pisos>
    </propiedad>

</propiedades>

<pisos>
    <piso>
        <nombre>PisoGrande</nombre>
        <descripcion>Piso de 500 metros cuadrados, con piscina.</descripcion>
        <precio>5000000</precio>

    </piso>

</pisos>
</inmobiliaria>